[
  {
    "schema": "figuregen/v1",
    "id": "scatter",
    "kind": "hotspot",
    "domain": "Process",
    "topic": "Scatter / correlation",
    "difficulty": "easy",
    "viewBox": [294, 196],
    "prompt": "These two variables are correlated. Tap the single observation that breaks the pattern.",
    "vars": {
      "ix": { "range": 9 },
      "outlier": { "int": [2, 7] },
      "above": { "pick": [0, 1] },
      "jit": { "sampleInt": [-5, 5], "count": 9 },
      "off": { "int": [24, 38] }
    },
    "draw": [
      { "op": "line", "x1": 44, "y1": 172, "x2": 286, "y2": 172, "width": 1.3 },
      { "op": "line", "x1": 44, "y1": 24, "x2": 44, "y2": 172, "width": 1.3 },
      { "op": "text", "x": 147, "y": 188, "text": "'review hours →'", "size": 8, "anchor": "middle" },
      {
        "op": "repeat",
        "over": "ix",
        "do": [
          {
            "op": "circle",
            "cx": "60 + i*26",
            "cy": "clamp(150 - i*12 + jit[i] + (i==outlier ? (above ? -1 : 1)*off : 0), 28, 168)",
            "r": 3.4,
            "fill": "ink"
          }
        ]
      }
    ],
    "regions": {
      "repeat": "ix",
      "items": [
        {
          "id": "i",
          "x": "60 + i*26 - 12",
          "y": "clamp(150 - i*12 + jit[i] + (i==outlier ? (above ? -1 : 1)*off : 0), 28, 168) - 12",
          "w": 24,
          "h": 24,
          "correct": "i == outlier",
          "label": "'Point ' + (i+1)",
          "why": "i == outlier ? 'Sits far off the trend — the outlier to investigate.' : 'Sits on the trend line with the rest.'"
        }
      ]
    },
    "explanation": "Most points rise together; one sits well off that trend line — the outlier worth a closer look."
  },
  {
    "schema": "figuregen/v1",
    "id": "control-chart",
    "kind": "hotspot",
    "domain": "Process",
    "topic": "Control charts",
    "difficulty": "medium",
    "viewBox": [312, 188],
    "prompt": "Tap the data point that signals the process is out of control.",
    "caption": "Dashed = control limits; solid = mean.",
    "vars": {
      "bad": { "int": [1, 7] },
      "above": { "pick": [0, 1] },
      "inside": { "sampleInt": [58, 134], "count": 8 },
      "hi": { "int": [20, 32] },
      "lo": { "int": [160, 172] }
    },
    "derived": {
      "ys": "[bad==0?(above?hi:lo):inside[0], bad==1?(above?hi:lo):inside[1], bad==2?(above?hi:lo):inside[2], bad==3?(above?hi:lo):inside[3], bad==4?(above?hi:lo):inside[4], bad==5?(above?hi:lo):inside[5], bad==6?(above?hi:lo):inside[6], bad==7?(above?hi:lo):inside[7]]"
    },
    "draw": [
      { "op": "line", "x1": 40, "y1": 40, "x2": 266, "y2": 40, "width": 1, "dash": "4 4" },
      { "op": "line", "x1": 40, "y1": 152, "x2": 266, "y2": 152, "width": 1, "dash": "4 4" },
      { "op": "line", "x1": 40, "y1": 96, "x2": 266, "y2": 96, "width": 1.1 },
      { "op": "text", "x": 278, "y": 43, "text": "'UCL'", "size": 8, "anchor": "end" },
      { "op": "text", "x": 278, "y": 155, "text": "'LCL'", "size": 8, "anchor": "end" },
      { "op": "text", "x": 280, "y": 93, "text": "'mean'", "size": 8, "anchor": "end" },
      {
        "op": "polyline",
        "points": [48, "ys[0]", 78, "ys[1]", 108, "ys[2]", 138, "ys[3]", 168, "ys[4]", 198, "ys[5]", 228, "ys[6]", 258, "ys[7]"],
        "width": 1.6
      },
      {
        "op": "repeat",
        "over": "ys",
        "as": "y",
        "do": [{ "op": "circle", "cx": "48 + i*30", "cy": "y", "r": 3.5, "fill": "ink" }]
      }
    ],
    "regions": {
      "repeat": "ys",
      "as": "y",
      "items": [
        {
          "id": "i",
          "x": "48 + i*30 - 11",
          "y": "y - 11",
          "w": 22,
          "h": 22,
          "correct": "i == bad",
          "label": "'Point ' + (i+1)",
          "why": "i == bad ? ('Beyond the ' + (above ? 'upper' : 'lower') + ' control limit — an out-of-control signal.') : 'Within the control limits.'"
        }
      ]
    },
    "select": 1,
    "explanation": "A process is out of control when a point falls outside the control limits. Point {{bad+1}} breaches the {{above ? 'UCL' : 'LCL'}}; the rest sit within the limits."
  },
  {
    "schema": "figuregen/v1",
    "id": "critical-path",
    "kind": "hotspot",
    "domain": "Process",
    "topic": "Schedule",
    "difficulty": "medium",
    "viewBox": [320, 220],
    "prompt": "Total float = LS − ES. Tap EVERY activity that is not on the critical path (i.e. has float).",
    "caption": "Two parallel paths from Start to End. Each box: ES|EF (top), LS|LF (bottom).",
    "vars": {
      "dA": { "int": [2, 9] },
      "dB": { "int": [2, 9] },
      "dC": { "int": [2, 9] },
      "dD": { "int": [2, 9] }
    },
    "guard": "dA + dB != dC + dD",
    "derived": {
      "p1": "dA + dB",
      "p2": "dC + dD",
      "T": "max(p1, p2)",
      "efA": "dA",
      "efB": "dA + dB",
      "efC": "dC",
      "efD": "dC + dD",
      "lsB": "T - dB",
      "lsA": "lsB - dA",
      "lsD": "T - dD",
      "lsC": "lsD - dC",
      "floatTop": "T - p1",
      "floatBot": "T - p2",
      "longer": "p1 > p2 ? 'A→B' : 'C→D'",
      "shorter": "p1 > p2 ? 'C→D' : 'A→B'",
      "slack": "T - min(p1, p2)"
    },
    "draw": [
      { "op": "circle", "cx": 28, "cy": 110, "r": 13, "width": 1.4 },
      { "op": "text", "x": 28, "y": 113, "text": "'Start'", "size": 8.5, "anchor": "middle" },
      { "op": "circle", "cx": 292, "cy": 110, "r": 13, "width": 1.4 },
      { "op": "text", "x": 292, "y": 113, "text": "'End'", "size": 9, "anchor": "middle" },
      { "op": "line", "x1": 40, "y1": 104, "x2": 78, "y2": 63, "width": 1.3 },
      { "op": "line", "x1": 40, "y1": 116, "x2": 78, "y2": 163, "width": 1.3 },
      { "op": "arrow", "x1": 136, "y1": 63, "x2": 170, "y2": 63, "width": 1.4, "head": 8 },
      { "op": "arrow", "x1": 136, "y1": 163, "x2": 170, "y2": 163, "width": 1.4, "head": 8 },
      { "op": "line", "x1": 228, "y1": 63, "x2": 280, "y2": 104, "width": 1.3 },
      { "op": "line", "x1": 228, "y1": 163, "x2": 280, "y2": 116, "width": 1.3 },

      { "op": "rect", "x": 78, "y": 40, "w": 58, "h": 46, "rx": 4, "width": 1.4 },
      { "op": "text", "x": 107, "y": 54, "text": "0 + ' | ' + efA", "size": 9, "anchor": "middle" },
      { "op": "text", "x": 107, "y": 68, "text": "'A ' + dA", "size": 11, "anchor": "middle" },
      { "op": "text", "x": 107, "y": 80, "text": "lsA + ' | ' + (lsA + dA)", "size": 9, "anchor": "middle" },

      { "op": "rect", "x": 170, "y": 40, "w": 58, "h": 46, "rx": 4, "width": 1.4 },
      { "op": "text", "x": 199, "y": 54, "text": "efA + ' | ' + efB", "size": 9, "anchor": "middle" },
      { "op": "text", "x": 199, "y": 68, "text": "'B ' + dB", "size": 11, "anchor": "middle" },
      { "op": "text", "x": 199, "y": 80, "text": "lsB + ' | ' + (lsB + dB)", "size": 9, "anchor": "middle" },

      { "op": "rect", "x": 78, "y": 140, "w": 58, "h": 46, "rx": 4, "width": 1.4 },
      { "op": "text", "x": 107, "y": 154, "text": "0 + ' | ' + efC", "size": 9, "anchor": "middle" },
      { "op": "text", "x": 107, "y": 168, "text": "'C ' + dC", "size": 11, "anchor": "middle" },
      { "op": "text", "x": 107, "y": 180, "text": "lsC + ' | ' + (lsC + dC)", "size": 9, "anchor": "middle" },

      { "op": "rect", "x": 170, "y": 140, "w": 58, "h": 46, "rx": 4, "width": 1.4 },
      { "op": "text", "x": 199, "y": 154, "text": "efC + ' | ' + efD", "size": 9, "anchor": "middle" },
      { "op": "text", "x": 199, "y": 168, "text": "'D ' + dD", "size": 11, "anchor": "middle" },
      { "op": "text", "x": 199, "y": 180, "text": "lsD + ' | ' + (lsD + dD)", "size": 9, "anchor": "middle" },

      { "op": "text", "x": 160, "y": 212, "text": "'ES | EF on top  ·  LS | LF below'", "size": 9, "anchor": "middle" }
    ],
    "regions": [
      {
        "id": "'A'",
        "x": 78,
        "y": 40,
        "w": 58,
        "h": 46,
        "correct": "floatTop > 0",
        "label": "'A'",
        "why": "floatTop > 0 ? ('Float ' + (lsA - 0) + ' (LS ' + lsA + ' ≠ ES 0) — off the critical path.') : 'Zero float — on the critical path.'"
      },
      {
        "id": "'B'",
        "x": 170,
        "y": 40,
        "w": 58,
        "h": 46,
        "correct": "floatTop > 0",
        "label": "'B'",
        "why": "floatTop > 0 ? ('Float ' + (lsB - efA) + ' (LS ' + lsB + ' ≠ ES ' + efA + ') — off the critical path.') : 'Zero float — on the critical path.'"
      },
      {
        "id": "'C'",
        "x": 78,
        "y": 140,
        "w": 58,
        "h": 46,
        "correct": "floatBot > 0",
        "label": "'C'",
        "why": "floatBot > 0 ? ('Float ' + (lsC - 0) + ' (LS ' + lsC + ' ≠ ES 0) — off the critical path.') : 'Zero float — on the critical path.'"
      },
      {
        "id": "'D'",
        "x": 170,
        "y": 140,
        "w": 58,
        "h": 46,
        "correct": "floatBot > 0",
        "label": "'D'",
        "why": "floatBot > 0 ? ('Float ' + (lsD - efC) + ' (LS ' + lsD + ' ≠ ES ' + efC + ') — off the critical path.') : 'Zero float — on the critical path.'"
      }
    ],
    "explanation": "Path A→B = {{p1}}, path C→D = {{p2}}. The longer path {{longer}} is critical (zero float); the two activities on the shorter path {{shorter}} each carry {{slack}} day{{slack==1 ? '' : 's'}} of float."
  }
]
