[
  {
    "schema": "figuregen/v1",
    "id": "cost-of-quality",
    "kind": "hotspot",
    "domain": "Process",
    "topic": "Cost of quality",
    "difficulty": "medium",
    "viewBox": [
      270,
      204
    ],
    "prompt": "{{mode==1 ? 'Failure costs are eating the budget. To cut the total cost of quality, tap the category to invest MORE in to stop defects upstream.' : 'Tap the bar for the largest cost of NONconformance.'}}",
    "caption": "Prevention & appraisal = conformance; internal & external failure = nonconformance.",
    "vars": {
      "v": {
        "sampleInt": [
          6,
          24
        ],
        "count": 4
      },
      "order": {
        "shuffle": [
          0,
          1,
          2,
          3
        ]
      },
      "mode": {
        "pick": [
          0,
          1
        ]
      }
    },
    "guard": "v[2] != v[3]",
    "derived": {
      "baseN": "['Prevention','Appraisal','Internal','External']",
      "baseF": "[0,0,1,1]",
      "baseP": "[1,0,0,0]",
      "bars": "[[baseN[order[0]],v[order[0]],baseF[order[0]],baseP[order[0]]],[baseN[order[1]],v[order[1]],baseF[order[1]],baseP[order[1]]],[baseN[order[2]],v[order[2]],baseF[order[2]],baseP[order[2]]],[baseN[order[3]],v[order[3]],baseF[order[3]],baseP[order[3]]]]",
      "maxFailVal": "max(v[2], v[3])",
      "worstName": "v[2] > v[3] ? 'Internal failure' : 'External failure'"
    },
    "draw": [
      {
        "op": "line",
        "x1": 24,
        "y1": 168,
        "x2": 264,
        "y2": 168,
        "width": 1.3
      },
      {
        "op": "repeat",
        "over": "bars",
        "as": "b",
        "do": [
          {
            "op": "rect",
            "x": "30 + i*60",
            "y": "168 - 138*b[1]/26",
            "w": 46,
            "h": "138*b[1]/26",
            "rx": 3,
            "fill": "ink",
            "fillOpacity": 0.1
          },
          {
            "op": "text",
            "x": "30 + i*60 + 23",
            "y": "168 - 138*b[1]/26 - 4",
            "text": "b[1]",
            "size": 8,
            "anchor": "middle"
          },
          {
            "op": "text",
            "x": "30 + i*60 + 23",
            "y": 184,
            "text": "b[0]",
            "size": 7.5,
            "anchor": "middle"
          }
        ]
      }
    ],
    "regions": {
      "repeat": "bars",
      "as": "b",
      "items": [
        {
          "id": "i",
          "x": "30 + i*60",
          "y": 30,
          "w": 46,
          "h": 138,
          "correct": "mode==1 ? (b[3]==1) : (b[2]==1 && b[1]==maxFailVal)",
          "label": "b[0]",
          "why": "mode==1 ? (b[3]==1 ? 'Prevention — spend here to stop defects before they become costly failures (the COQ leverage point).' : (b[2]==1 ? 'A failure cost — the symptom of too little prevention, not where you invest first.' : 'Appraisal finds defects but does not prevent them.')) : (b[2]==0 ? 'A conformance cost (prevention/appraisal), not a failure cost.' : (b[1]==maxFailVal ? 'A failure (nonconformance) cost, and the larger of the two.' : 'A failure cost, but smaller than the other failure bucket.'))"
        }
      ]
    },
    "explanation": "{{mode==1 ? 'Prevention is the cost-of-quality leverage point — a dollar spent preventing defects saves many in internal and external failure costs.' : 'Nonconformance = failure costs (internal + external). '}}{{mode==1 ? '' : worstName + ' is the larger failure bucket; prevention and appraisal are conformance costs.'}}"
  },
  {
    "schema": "figuregen/v1",
    "id": "histogram-spec",
    "kind": "hotspot",
    "domain": "Process",
    "topic": "Quality / specification",
    "difficulty": "hard",
    "freeSelect": true,
    "viewBox": [
      360,
      188
    ],
    "prompt": "Tap every bar that falls outside the specification limits — check against BOTH the LSL and the USL.",
    "caption": "Dashed lines = LSL and USL.",
    "vars": {
      "outLow": {
        "int": [
          0,
          2
        ]
      },
      "outHigh": {
        "int": [
          0,
          2
        ]
      },
      "h": {
        "sampleInt": [
          55,
          130
        ],
        "count": 9
      },
      "r9": {
        "range": 9
      }
    },
    "guard": "outLow + outHigh >= 1 && outLow + outHigh <= 3",
    "derived": {
      "lslX": "40 + outLow*32 - 5",
      "uslX": "40 + (9-outHigh)*32 - 5",
      "nOut": "outLow + outHigh"
    },
    "draw": [
      {
        "op": "line",
        "x1": 34,
        "y1": 168,
        "x2": 336,
        "y2": 168,
        "width": 1.3
      },
      {
        "op": "line",
        "x1": "lslX",
        "y1": 24,
        "x2": "lslX",
        "y2": 168,
        "width": 1.1,
        "dash": "5 3"
      },
      {
        "op": "text",
        "x": "lslX",
        "y": 20,
        "text": "'LSL'",
        "size": 8,
        "anchor": "middle"
      },
      {
        "op": "line",
        "x1": "uslX",
        "y1": 24,
        "x2": "uslX",
        "y2": 168,
        "width": 1.1,
        "dash": "5 3"
      },
      {
        "op": "text",
        "x": "uslX",
        "y": 20,
        "text": "'USL'",
        "size": 8,
        "anchor": "middle"
      },
      {
        "op": "repeat",
        "over": "r9",
        "do": [
          {
            "op": "rect",
            "x": "40 + i*32",
            "y": "168 - h[i]",
            "w": 26,
            "h": "h[i]",
            "rx": 2,
            "fill": "ink",
            "fillOpacity": 0.1
          }
        ]
      }
    ],
    "regions": {
      "repeat": "r9",
      "items": [
        {
          "id": "i",
          "x": "40 + i*32 - 3",
          "y": 24,
          "w": 32,
          "h": 144,
          "correct": "(i < outLow) || (i >= 9-outHigh)",
          "label": "'Bar ' + (i+1)",
          "why": "(i < outLow || i >= 9-outHigh) ? ('Beyond the ' + (i < outLow ? 'LSL' : 'USL') + ' — out of specification.') : ((i==outLow || i==8-outHigh) ? 'Sits just inside a limit — tempting, but still in spec.' : 'Comfortably within the limits.')"
        }
      ]
    },
    "explanation": "{{nOut}} bar(s) fall outside the limits ({{outLow}} below the LSL, {{outHigh}} above the USL). Height is a red herring — a tall in-spec bar is fine, a short out-of-spec bar is still a defect; only the position relative to each limit decides it."
  }
]